"240";"embûche";"+";"-";"-";"-";"+";"-";"-";"Ce (travail+texte+chemin) (a+présente) des embûches";"Il y a des embûches dans ce (travail+texte+chemin)";"~";"~";"~"
"241";"éminence";"+";"-";"+";"-";"+";"-";"-";"Ce terrain a des éminences à cet endroit";"~";"~";"~";"~"
"242";"encart";"-";"-";"-";"-";"+";"-";"-";"Ce livre a un encart";"~";"~";"~";"~"
"243";"enceinte";"+";"-";"+";"-";"+";"-";"-";"La ville a une enceinte crénelée";"~";"~";"~";"~"
"244";"endroit";"+";"-";"-";"+";"-";"-";"-";"Ce tissu a un endroit";"~";"~";"~";"~"
"245";"énergie";"+";"-";"+";"-";"+";"-";"-";"Cette région a une énergie";"~";"~";"~";"~"
"246";"enfer";"+";"-";"-";"-";"+";"+";"-";"Cette bibliothèque comporte un enfer";"~";"~";"~";"~"
"247";"enfoncement";"+";"-";"+";"-";"+";"-";"-";"~";"~";"La façade a un enfoncement de 5 cm";"~";"~"
"248";"enfourchure";"+";"-";"-";"+";"-";"-";"-";"L'arbre a une enfourchure";"~";"~";"~";"~"
"249";"engrenage";"+";"-";"-";"-";"+";"+";"-";"Cet appareil a un engrenage";"~";"~";"~";"~"
"250";"enjeu";"+";"-";"+";"-";"+";"-";"-";"(Cette guerre a un enjeu+Cette partie a un enjeu (E+pour Léa+de tout))";"Il y a un enjeu dans cette guerre";"~";"~";"~"
"251";"en-tête ";"+";"-";"-";"+";"-";"+";"+";"Ce texte a un en-tête";"Il y a un en-tête à ce texte";"~";"~";"~"
"252";"entrée";"+";"-";"-";"+";"+";"-";"-";"Ce mot a une entrée dans le dictionnaire";"~";"~";"~";"~"
"253";"entrée";"+";"-";"-";"-";"+";"+";"-";"Cette maison a deux entrées";"~";"~";"~";"~"
"254";"entrefilet";"+";"-";"+";"-";"+";"+";"-";"Cette page (a+comporte) un entrefilet";"Il y a un entrefilet dans cette page";"~";"~";"~"
"255";"entropie";"+";"-";"-";"-";"+";"-";"-";"Ce système a une entropie";"~";"~";"~";"~"
"256";"envers";"+";"-";"-";"+";"-";"-";"-";"(Cet objet+Cette question) a un envers";"~";"~";"~";"~"
"257";"épicentre";"+";"-";"-";"-";"+";"-";"-";"~";"~";"~";"~";"~"
"258";"épigraphe";"+";"-";"-";"-";"+";"+";"-";"Ce (mouvement+livre) a une épigraphe";"Il y a une épigraphe sur ce (mouvement+livre)";"~";"~";"~"
"259";"épilogue";"+";"-";"-";"+";"-";"-";"-";"Cette histoire a un épilogue";"Il y a un épilogue à cette histoire";"~";"~";"~"
"260";"épisode";"+";"-";"-";"-";"+";"-";"-";"Cette histoire a plusieurs épisodes";"Il y a plusieurs épisodes dans cette histoire";"~";"~";"~"
"261";"équipage";"+";"-";"+";"+";"-";"-";"-";"Cet avion a un équipage";"~";"~";"~";"Les personnes forment l'équipage de l'avion"
"262";"équivoque";"+";"-";"-";"-";"+";"-";"-";"Ce texte (a+comporte) une équivoque";"Il y a une équivoque dans ce texte";"~";"~";"~"
"263";"errata";"+";"-";"-";"-";"+";"+";"-";"Ce livre comporte un errata";"~";"~";"~";"~"
"264";"erreur";"+";"-";"+";"-";"+";"-";"+";"Ce texte a une erreur";"Il y a une erreur (E+de calcul) (E+dans les calculs)";"~";"~";"~"
"265";"escarpement";"+";"-";"+";"-";"-";"-";"-";"Le talus a un escarpement";"Il y a un escarpement à ce talus";"Le talus a un escarpement de 20 unités";"~";"~"
"266";"espace";"+";"-";"+";"-";"+";"-";"-";"~";"~";"~";"Cette maison a de l'espace";"~"
"267";"espèce";"+";"-";"-";"-";"+";"-";"-";"Le monde animal (a+comporte) plusieurs espèces";"Il y a plusieurs espèces dans le monde animal";"~";"~";"GN =: [Cette espèce de gens]"
"268";"esprit";"+";"-";"-";"-";"+";"-";"-";"(Ce journal+Cette époque) a un certain esprit";"Il y a un certain esprit dans ce journal";"~";"~";"~"
"269";"essence";"+";"-";"-";"-";"+";"+";"-";"La forêt comporte plusieurs essences";"~";"~";"~";"GN =: [une essence étrange]"
"270";"est";"+";"-";"-";"-";"+";"-";"-";"Cette région a un est";"~";"~";"~";"GN =: [L'est de cette région]"
"271";"estuaire";"+";"-";"+";"-";"+";"-";"-";"Ce fleuve a un estuaire";"~";"~";"~";"~"
"272";"étage";"+";"-";"-";"-";"+";"-";"+";"Cet immeuble a plusieurs étages";"Il y a plusieurs étages à cet immeuble";"~";"~";"GN =: [un étage de collines]"
"273";"étape";"+";"-";"+";"-";"+";"-";"-";"Cette course (a+compote) trois étapes";"Il y a trois étapes dans cette course";"~";"~";"~"
"274";"état";"+";"-";"-";"-";"+";"-";"-";"Ce pays a un Etat";"~";"~";"~";"~"
"275";"état-major";"+";"+";"+";"-";"+";"-";"-";"L'armée a un état-major";"~";"~";"~";"~"
"276";"étiquette";"+";"-";"-";"-";"+";"-";"-";"(La cour+Cette cérémonie) a une étiquette";"Il y a une étiquette (à la cour+dans cette cérémonie)";"~";"~";"~"
"277";"étoffe";"+";"-";"-";"-";"+";"-";"-";"Ce roman a une certaine étoffe";"Il y a de l'étoffe dans ce roman";"~";"~";"~"
"278";"étranglement";"+";"-";"+";"-";"+";"-";"-";"La route a un étranglement";"Il y a un étranglement (sur ce parcours+de la route)";"~";"~";"~"
"279";"eurythmie";"+";"-";"-";"-";"+";"-";"-";"Ce tableau (a+présente) une belle eurythmie";"Il y a une belle eurythmie dans ce tableau";"~";"~";"~"
"280";"évacuation";"+";"-";"-";"-";"+";"+";"-";"~";"Il y a une bonne évacuation dans cette salle de bain";"~";"~";"~"
"281";"excavation";"+";"-";"+";"-";"+";"-";"+";"Le sol a une excavation";"Il y a une excavation dans le sol";"~";"~";"~"
"282";"exception";"+";"-";"-";"+";"-";"-";"-";"~";"~";"~";"~";"~"
"283";"excroissance";"+";"+";"+";"-";"+";"-";"-";"Le tronc de cet arbre a une excroissance";"Il y a une excroissance sur le tronc de l'arbre";"~";"~";"~"
"284";"exergue";"+";"-";"-";"-";"+";"+";"-";"Ce texte a un exergue";"~";"~";"~";"~"
"285";"exposant";"+";"-";"-";"+";"-";"+";"-";"(Cette équation+Ce nombre) a un exposant";"Il y a un exposant dans (cette équation+ce nombre)";"~";"~";"~"
"286";"exposition";"+";"-";"-";"-";"+";"-";"+";"Cette pièce de théâtre a une exposition";"~";"~";"~";"~"
"287";"extérieur";"+";"-";"-";"+";"-";"-";"-";"Cette boîte a un extérieur (et un intérieur)";"~";"~";"~";"~"
"288";"extérieurs";"+";"-";"-";"-";"+";"+";"+";"~";"~";"~";"~";"~"
"289";"externat";"+";"-";"-";"-";"+";"-";"+";"Cet établissement a un externat";"Il y a un externat dans cet établissement";"~";"~";"~"
"290";"extrémité";"+";"-";"-";"+";"-";"-";"-";"Ce bâton a une extrémité arrondie";"~";"~";"~";"~"
"291";"face";"+";"-";"-";"-";"+";"-";"-";"Ce cube a 6 faces";"~";"~";"~";"~"
"292";"facette";"+";"-";"-";"-";"+";"-";"-";"Ce diamant a des facettes";"~";"~";"~";"~"
"293";"facilités";"+";"-";"-";"-";"+";"-";"-";"Ce métier comporte des facilités";"~";"~";"~";"~"
"294";"facteur";"+";"-";"-";"-";"+";"-";"-";"La situation (économique+épidémiologie) (a+comporte) plusieurs facteurs";"Il y a plusieurs facteurs dans la situation (économique+épidémiologie)";"~";"~";"~"
"295";"faille";"+";"-";"+";"-";"+";"-";"-";"Ce terrain a une faille";"Il y a une faille dans ce terrain";"Ce terrain a une faille de 500 mètres";"~";"~"
"296";"faille";"+";"-";"-";"-";"+";"-";"-";"Ce raisonnement a une faille";"~";"~";"~";"~"
"297";"faîte";"+";"-";"-";"+";"-";"-";"-";"Le toit a un faîte";"~";"~";"~";"~"
"298";"faune";"+";"-";"-";"-";"+";"-";"-";"Ce pays a une faune";"Il y a une faune dans ce pays";"~";"~";"~"
"299";"faute";"+";"-";"-";"-";"+";"-";"+";"Ce texte a des fautes";"Il y a des fautes dans ce texte";"~";"~";"~"
"300";"féminin";"+";"-";"-";"+";"+";"-";"-";"(Ce mot+Cette langue) a un féminin";"~";"~";"~";"~"
"301";"fermeture";"+";"-";"-";"+";"+";"+";"-";"Ce coffre a une fermeture hermétique";"~";"~";"~";"La construction a fait une fermeture hermétique au coffre"
"302";"ficelles";"+";"-";"-";"-";"+";"-";"-";"Ce métier a des ficelles";"~";"~";"~";"~"
"303";"figurant";"+";"-";"-";"-";"+";"-";"-";"Ce film a des figurants";"~";"~";"~";"~"
"304";"fil";"+";"-";"-";"-";"+";"-";"-";"Cette histoire a un fil";"~";"~";"~";"~"
"305";"filiale";"+";"-";"-";"-";"+";"-";"-";"Cette société a une filiale";"~";"~";"~";"~"
"306";"filière";"+";"-";"-";"-";"+";"-";"-";"(Ce trafic+Cette formation) (a+comporte) une filière";"~";"~";"~";"Max suit la filière de cette formation"
"307";"fin";"+";"-";"-";"+";"-";"-";"-";"Le spectacle a une fin";"~";"~";"~";"~"
"308";"final [e]";"+";"-";"-";"-";"+";"+";"-";"Ce morceau a un final (?E+endiablé)";"~";"~";"~";"~"
"309";"finale";"+";"-";"-";"-";"+";"-";"-";"La course (a+comporte) une finale";"il y a une finale (E+dans cette course)";"~";"~";"~"
"310";"finalité";"+";"-";"-";"+";"+";"-";"-";"Le monde a une finalité";"~";"~";"~";"~"
"311";"fiscalité";"+";"-";"+";"-";"+";"-";"-";"Ce pays a une fiscalité lourde";"~";"~";"~";"~"
"312";"fleuron";"+";"-";"-";"-";"+";"-";"-";"Cette collection a des fleurons";"~";"~";"~";"~"
"313";"flexion";"+";"-";"-";"-";"+";"-";"-";"Ce mot a une flexion";"~";"~";"~";"~"
"314";"flore";"+";"-";"-";"-";"+";"-";"-";"Ce pays a une flore";"~";"~";"~";"~"
"315";"flotte";"-";"+";"+";"-";"+";"-";"-";"Ce pays a une flotte";"~";"~";"~";"~"
"316";"folklore";"+";"-";"-";"-";"+";"-";"-";"Ce pays a un folklore";"~";"~";"~";"~"
"317";"fonction";"+";"-";"-";"-";"+";"-";"-";"Le corps comporte des fonctions";"~";"~";"~";"~"
"318";"fond";"+";"-";"-";"+";"-";"-";"-";"Cette affaire a un fond";"~";"~";"~";"Je connais le fond de ta pensée"
"319";"fondement";"+";"-";"-";"+";"-";"-";"-";"~";"~";"~";"~";"~"
"320";"force";"+";"-";"-";"-";"+";"-";"-";"~";"~";"~";"~";"~"
"321";"formant";"+";"-";"-";"-";"+";"-";"-";"~";"~";"~";"~";"~"
"322";"forme";"+";"-";"-";"-";"+";"-";"-";"~";"~";"~";"~";"~"
"323";"forte";"+";"-";"-";"-";"+";"+";"-";"~";"~";"~";"~";"~"
"324";"foyer";"+";"-";"-";"-";"+";"-";"-";"~";"~";"~";"~";"~"
"325";"fracture";"+";"-";"-";"-";"+";"-";"-";"~";"~";"~";"~";"~"
"326";"frange";"+";"+";"-";"-";"+";"-";"-";"~";"~";"~";"~";"~"
"327";"frein";"+";"-";"-";"+";"-";"+";"-";"~";"~";"~";"~";"~"
"328";"fréquentatif";"+";"-";"-";"-";"+";"-";"-";"~";"~";"~";"~";"~"
"329";"fret";"+";"-";"+";"-";"+";"+";"-";"~";"~";"~";"~";"~"
"330";"frontière";"+";"-";"-";"+";"-";"-";"-";"~";"~";"~";"~";"~"
"331";"futur";"+";"-";"-";"+";"-";"-";"-";"~";"~";"~";"~";"~"
"332";"gagnant";"+";"-";"-";"-";"+";"-";"-";"Ce jeu (a+comporte) un gagnant";"~";"~";"~";"~"
"333";"gap";"+";"-";"-";"-";"+";"-";"-";"Ce pays (?a+connaît) un gap technologique";"~";"~";"~";"~"
"334";"gauche";"-";"+";"-";"-";"+";"-";"-";"(Ce pays+Ce parti+Cet objet) a une gauche";"~";"~";"~";"GN =: [La gauche de cet objet]"
"335";"génitif";"+";"-";"-";"-";"+";"-";"-";"(Cette déclinaison+L'allemand) a un génitif";"~";"~";"~";"~"
"336";"genre";"+";"-";"-";"-";"+";"-";"-";"Cette famille (a+comporte) plusieurs genres";"~";"~";"~";"~"
"337";"germen";"+";"-";"-";"-";"+";"-";"-";"L'organisme (a+comporte) un germen";"~";"~";"~";"~"
"338";"gérondif";"+";"-";"-";"-";"+";"-";"-";"Cette langue a un gérondif";"~";"~";"~";"~"
"339";"glissando";"+";"-";"-";"-";"+";"+";"-";"Ce passage (a+comporte) un glissando";"~";"~";"~";"~"
"340";"glossaire";"+";"-";"+";"-";"+";"-";"-";"Ce livre a un glossaire";"~";"~";"~";"~"
"341";"gradation";"+";"-";"-";"-";"+";"-";"-";"Les efforts de Max ont une gradation";"~";"~";"~";"~"
"342";"graduation";"+";"-";"+";"-";"+";"+";"-";"~";"~";"~";"~";"~"
"343";"grain";"+";"-";"-";"-";"+";"-";"-";"~";"~";"~";"Cette photo a du grain";"~"
"344";"granulation";"+";"-";"-";"-";"+";"-";"-";"Ce tissu a des granulations";"~";"~";"~";"~"
"345";"habitacle";"+";"-";"-";"-";"+";"+";"-";"Ce bateau a un habitacle";"~";"~";"~";"~"
"346";"habitant";"+";"-";"-";"-";"+";"-";"-";"Cette île a des habitants";"~";"~";"~";"~"
"347";"habitat";"+";"-";"-";"-";"+";"-";"-";"(Le tigre+Cette région) a un certain habitat";"~";"~";"~";"~"
"348";"halo";"+";"-";"-";"-";"+";"-";"-";"Cette planète a un halo";"~";"~";"~";"~"
"349";"harmonique";"+";"-";"-";"-";"+";"-";"-";"Ce son a une harmonique";"~";"~";"~";"~"
"350";"haut";"+";"-";"-";"+";"-";"-";"-";"Ce (vêtement+meuble) a un haut";"~";"~";"~";"~"
"351";"hiérarchie";"+";"+";"-";"-";"+";"-";"-";"L'église a une hiérarchie";"~";"~";"~";"~"
"352";"hinterland";"+";"-";"-";"-";"+";"-";"-";"Cette côte a un hinterland";"~";"~";"~";"~"
"353";"horizon";"+";"-";"-";"+";"+";"-";"-";"Ce paysage a un horizon";"~";"~";"~";"~"
"354";"hydrographie";"+";"-";"-";"-";"+";"-";"-";"~";"~";"~";"~";"~"
"355";"hypoténuse";"+";"-";"-";"-";"+";"-";"-";"Le triangle a une hypoténuse";"~";"~";"~";"~"
"356";"images";"+";"-";"-";"-";"+";"+";"-";"Ce livre (a+comporte) des images";"~";"~";"~";"~"
"357";"imparfait";"+";"-";"-";"-";"+";"-";"-";"Cette (langue+conjugaison) a un imparfait";"~";"~";"~";"~"
"358";"impératif";"+";"-";"-";"-";"+";"-";"-";"Cette (langue+conjugaison) a un impératif";"~";"~";"~";"~"
"359";"implication";"+";"-";"-";"-";"+";"-";"-";"(Cet accord+Cette proportion) a (une implication+des implications)";"~";"~";"~";"~"
"360";"incidente";"+";"-";"-";"-";"+";"-";"-";"Cette proposition a une incidente";"~";"~";"~";"~"
"361";"inconnue";"+";"-";"-";"-";"+";"-";"-";"(Cette équation a une inconnue+La situation (a+comporte) une inconnue";"~";"~";"~";"~"
"362";"indentation";"+";"-";"-";"-";"+";"-";"-";"La côte a des indentations";"~";"~";"~";"~"
"363";"index";"+";"-";"-";"-";"+";"+";"+";"Ce livre a un index";"~";"~";"~";"~"
"364";"indicatif";"+";"-";"-";"-";"+";"-";"-";"(Ce verbe+Cette langue) a un indicatif";"~";"~";"~";"~"
"365";"indicatif";"+";"-";"-";"-";"+";"+";"-";"Cette émission a un indicatif";"~";"~";"~";"~"
"366";"indice";"+";"-";"-";"-";"+";"-";"-";"Cette histoire (a+comporte) un indice";"~";"~";"~";"~"
"367";"inférence";"+";"-";"-";"-";"+";"-";"-";"Ce raisonnement comporte une inférence";"~";"~";"~";"~"
"368";"infixe";"+";"-";"-";"-";"+";"-";"-";"Ce mot a un infixe";"~";"~";"~";"~"
"369";"infrastructure";"+";"-";"-";"-";"+";"-";"-";"Le pays a une infrastructure";"~";"~";"~";"~"
"370";"ingrédient";"+";"-";"-";"-";"+";"-";"-";"Ce livre comporte (un ingrédient+plusieurs ingrédients)";"~";"~";"~";"~"
"371";"interface";"+";"-";"-";"-";"+";"-";"+";"Ce deux systèmes ont une interface";"~";"~";"~";"~"
"372";"intérieur";"+";"-";"-";"-";"+";"-";"-";"(Ce volume+Cette boîte) a un intérieur";"~";"~";"~";"~"
"373";"internat";"+";"-";"-";"-";"+";"-";"+";"Cet établissement a un internat";"~";"~";"~";"~"
"374";"intitulé";"+";"-";"-";"-";"+";"-";"-";"Ce chapitre a un intitulé";"~";"~";"~";"~"
"375";"introduction";"+";"-";"-";"+";"+";"-";"-";"Cet article a une introduction";"~";"~";"~";"~"
"376";"invariant";"+";"-";"-";"-";"+";"-";"-";"Ce système a un invariant";"~";"~";"~";"~"
"377";"issue";"+";"-";"-";"-";"+";"+";"-";"~";"~";"~";"~";"~"
"378";"jeu";"+";"-";"-";"-";"+";"-";"-";"~";"~";"~";"Ce mécanisme a du jeu";"~"
"379";"label";"+";"-";"-";"+";"-";"-";"-";"Ce produit a un label";"~";"~";"~";"~"
"380";"lacune";"+";"-";"-";"-";"+";"-";"-";"~";"~";"~";"~";"~"
"381";"legato";"+";"-";"-";"-";"+";"-";"-";"Ce morceau comporte un legato";"~";"~";"~";"~"
"382";"légende";"+";"-";"-";"-";"+";"-";"-";"Cette carte a une légende";"~";"~";"~";"~"
"383";"leitmotiv";"+";"-";"-";"-";"+";"+";"-";"Ce (morceau+texte) comporte un leitmotiv";"~";"~";"~";"~"
"384";"lexique";"+";"-";"+";"-";"+";"-";"-";"Cette langue a un lexique";"~";"~";"~";"~"
"385";"lieu";"+";"-";"-";"-";"+";"-";"-";"~";"~";"~";"~";"~"
"386";"limite";"+";"-";"-";"+";"-";"+";"-";"L'injustice a (une limité+des limités)";"~";"~";"~";"~"
"387";"linéaments";"+";"-";"-";"-";"+";"-";"-";"Cette théorie comporte des linéaments";"~";"~";"~";"~"
"388";"liquidités";"+";"-";"-";"-";"+";"-";"-";"Ce compte (a+comporte) des liquidités";"~";"~";"~";"~"
"389";"lisière";"+";"-";"-";"+";"-";"-";"-";"(Ce tissu+Ce bois) a une lisière";"~";"~";"~";"~"
"390";"littérature";"+";"-";"-";"-";"+";"-";"-";"Ce pays a une littérature";"~";"~";"~";"~"
"391";"liturgie";"+";"-";"-";"-";"+";"-";"-";"Ce culte a une liturgie";"~";"~";"~";"~"
"392";"locatif";"+";"-";"-";"-";"+";"-";"-";"Cette déclinaison a un locatif";"~";"~";"~";"~"
"393";"locomotive";"-";"+";"-";"-";"+";"-";"-";"Ce mouvement a une locomotive";"~";"~";"~";"~"
"394";"loi";"+";"-";"-";"-";"+";"-";"-";"Ce pays a (une loi+des lois)";"~";"~";"~";"~"
"395";"logique";"+";"-";"-";"-";"+";"-";"-";"Ce comportement a une logique";"~";"~";"~";"~"
"396";"logistique";"+";"-";"-";"-";"+";"-";"-";"Les troupes ont une logistique";"~";"~";"~";"~"
"397";"majorité";"-";"+";"-";"-";"+";"-";"-";"Ce pays (a+comporte) une majorité";"~";"~";"~";"~"
"398";"marge";"+";"-";"+";"+";"+";"+";"-";"(Ce texte+Cette page) a une marge";"~";"~";"~";"~"
"399";"marque";"+";"-";"-";"+";"+";"-";"-";"Cette page a une marque";"~";"~";"~";"~"
"400";"masculin";"+";"-";"-";"-";"+";"-";"-";"(Cette langue+Ce nom) a un masculin";"~";"~";"~";"~"
"401";"matière";"+";"-";"-";"-";"+";"-";"-";"Ce roman a une certaine matière";"~";"~";"~";"~"
"402";"matière";"+";"-";"-";"-";"+";"+";"-";"Cet enseignement (a+comporte) (une matière+des matières)";"~";"~";"~";"~"
"403";"maximum";"+";"-";"+";"-";"+";"-";"-";"Cette crue a un maximum";"~";"~";"~";"~"
"404";"mécanisme";"+";"-";"-";"-";"+";"-";"-";"Ce comportement a un mécanisme";"~";"~";"~";"~"
"405";"médiatrice";"+";"-";"-";"-";"+";"-";"-";"Ce segment a une médiatrice";"~";"~";"~";"~"
"406";"membre";"-";"+";"-";"-";"+";"-";"-";"Cette association a (un membre+plusieurs membres)";"~";"~";"~";"~"
"407";"mémoire";"+";"-";"-";"-";"+";"-";"-";"~";"~";"Cet appareil a une mémoire (E+ de 2Go)";"~";"~"
"408";"mesure";"+";"-";"-";"+";"-";"-";"-";"Toute chose a une mesure";"Il y a une mesure à toute chose";"~";"~";"~"
"409";"météorologie";"+";"-";"-";"-";"+";"-";"-";"Ce pays a une météorologie (*E+capricieuse)";"~";"~";"~";"~"
"410";"microclimat";"+";"-";"-";"-";"+";"-";"-";"Ce pays a un microclimat";"~";"~";"~";"~"
"411";"milieu";"+";"-";"-";"-";"+";"-";"-";"Cette nappe a un milieu";"~";"~";"~";"~"
"412";"milieu";"+";"-";"-";"-";"+";"-";"-";"~";"~";"~";"~";"~"
"413";"minimum";"+";"-";"+";"-";"+";"-";"-";"La température a un minimum";"~";"~";"~";"~"
"414";"modalité";"+";"-";"-";"-";"+";"-";"-";"Cette (langue+phrase) a (une modalité+des modalités)";"~";"~";"~";"~"
"415";"mode";"+";"-";"-";"-";"+";"-";"-";"Cette langue a (un mode+plusieurs modes)";"~";"~";"~";"~"
"416";"mode";"+";"-";"-";"-";"+";"-";"-";"~";"~";"~";"~";"~"
"417";"modifieur";"+";"-";"-";"-";"+";"-";"-";"~";"~";"~";"~";"~"
"418";"module";"+";"-";"-";"-";"+";"-";"-";"~";"~";"~";"~";"~"
"419";"montée";"+";"-";"+";"-";"+";"-";"-";"~";"~";"~";"~";"~"
"420";"mortalité";"+";"+";"+";"-";"+";"-";"-";"Ce pays a une mortalité (*E+de 20%)";"~";"Ce pays a une mortalité de 20%";"~";"~"
"421";"mortinatalité";"+";"+";"+";"-";"+";"-";"-";"Ce pays a une mortinatalité (*E+de 10%)";"~";"Ce pays a une mortinatalité de 10%";"~";"~"
"422";"motif";"+";"-";"-";"+";"-";"-";"-";"Cette décision a un motif";"~";"~";"~";"~"
"423";"motif";"+";"-";"-";"-";"+";"-";"-";"Ce dessin a un joli motif";"~";"~";"~";"~"
"424";"mouvement";"+";"-";"-";"-";"+";"+";"-";"La terre a trois mouvements";"~";"~";"~";"~"
"425";"multiplicande";"+";"-";"-";"-";"+";"-";"-";"Cette division a un multiplicande";"~";"~";"~";"~"
"426";"multiplicateur";"+";"-";"-";"-";"+";"-";"-";"Cette division a un multiplicateur";"~";"~";"~";"~"
"427";"mythologie";"+";"-";"-";"-";"+";"-";"-";"Ce (lieu+pays) a une mythologie";"~";"~";"~";"~"
"428";"natalité";"+";"-";"+";"-";"+";"-";"-";"Ce pays a une natalité (*E+en progression)";"~";"~";"~";"~"
"429";"nom";"+";"-";"-";"-";"+";"-";"-";"Cet objet a un nom";"~";"~";"~";"~"
"430";"nombre";"+";"-";"-";"-";"+";"-";"-";"Le verbe a un nombre";"~";"~";"~";"~"
"431";"nord";"+";"-";"-";"-";"+";"-";"-";"Ce pays a un nord";"~";"~";"~";"une partie nord"
"432";"noyau";"+";"-";"-";"-";"+";"-";"-";"Cette théorie a un noyau";"~";"~";"~";"~"
"433";"nuisance";"+";"-";"-";"-";"+";"-";"-";"L'aéroport a des nuisances (E+pour les riverains)";"~";"~";"~";"~"
"434";"numérateur";"+";"-";"-";"-";"+";"-";"-";"la division a un numérateur";"~";"~";"~";"~"
"435";"numéro";"+";"-";"-";"-";"+";"-";"-";"Cet objet a un numéro";"~";"~";"~";"~"
"436";"numéro";"+";"-";"-";"-";"+";"+";"-";"Ce spectacle comporte un numéro";"~";"~";"~";"~"
"437";"obstacle";"+";"-";"-";"+";"-";"-";"-";"Ce (parcours+entreprise) comporte un obstacle";"~";"~";"~";"~"
"438";"odeur";"+";"-";"-";"-";"+";"-";"-";"~";"~";"~";"~";"~"
"439";"ombre";"+";"-";"-";"-";"+";"-";"-";"Cette colonne a une ombre ";"~";"~";"~";"~"
"440";"opérande";"+";"-";"-";"-";"+";"-";"-";"Cette opération a un opérande";"~";"~";"~";"~"
"441";"opérateur";"+";"-";"-";"-";"+";"-";"-";"Cette construction a un opérateur";"~";"~";"~";"~"
"442";"optatif";"+";"-";"-";"-";"+";"-";"-";"~";"~";"~";"~";"~"
"443";"optimum";"+";"-";"-";"-";"+";"-";"-";"Cette courbe a un optimum";"~";"~";"~";"~"
"444";"option";"+";"-";"-";"-";"+";"-";"-";"Cette (article+voiture) comporte une option";"~";"~";"~";"~"
"445";"orbite";"+";"-";"-";"-";"+";"-";"-";"Cette planète a une orbite";"~";"~";"~";"~"
"446";"ordinaire";"+";"-";"-";"-";"+";"-";"-";"Cette cérémonie comporte un ordinaire";"~";"~";"~";"~"
"447";"ordre";"+";"-";"-";"-";"+";"-";"-";"Le monde a un ordre";"~";"~";"~";"~"
"448";"origine";"+";"-";"-";"+";"-";"-";"-";"(Cette affaire+ Le langage) a une origine";"~";"~";"~";"~"
"449";"ornière";"+";"-";"+";"-";"+";"-";"-";"Le chemin a des ornières";"~";"~";"~";"~"
"450";"orthographe";"+";"-";"-";"-";"+";"-";"-";"Cette langue (a+comporte) une orthographe";"~";"~";"~";"~"
"451";"ouest";"+";"-";"-";"+";"+";"-";"-";"Ce pays a un ouest";"~";"~";"~";"une partie ouest"
"452";"ouverture";"+";"-";"+";"-";"+";"-";"-";"Cette boîte a une ouverture";"~";"~";"~";"~"
"453";"paléoclimat";"+";"-";"-";"-";"+";"-";"-";"Cette région a un paléoclimat (?E+original)";"~";"~";"~";"~"
"454";"participe";"+";"-";"-";"-";"+";"-";"-";"Cette langue a un participe";"~";"~";"~";"~"
"455";"particule";"+";"-";"-";"-";"+";"-";"-";"Ce corps a des particules";"~";"~";"~";"~"
"456";"partie";"+";"-";"-";"-";"+";"-";"-";"Ce (discours+objet) a plusieurs parties";"~";"~";"~";"~"
"457";"passage";"+";"-";"+";"-";"+";"+";"+";"Ce livre a un passage (*E+osé)";"~";"~";"~";"~"
"458";"passage";"+";"-";"+";"-";"+";"-";"-";"Cette maison a un passage (*E+secret)";"~";"~";"~";"~"
"459";"passerelle";"+";"-";"-";"-";"+";"-";"-";"Cet enseignement a des passerelles (E+entre N1 et N2)";"~";"~";"~";"~"
"460";"passif";"+";"-";"+";"-";"+";"-";"-";"Cette entreprise a un passif";"~";"Cette entreprise a un passif de 77 000 euros";"~";"~"
"461";"passif";"+";"-";"-";"-";"+";"-";"-";"Cette (langue+conjugaison) a un passif";"~";"~";"~";"~"
"462";"pendant";"+";"-";"-";"+";"-";"-";"-";"~";"~";"~";"~";"Le portrait de Luc est le pendant de celui de Léa"
"463";"pente";"+";"-";"+";"-";"+";"-";"-";"Le terrain a une certaine pente";"~";"~";"~";"~"
"464";"perdant";"+";"-";"-";"-";"+";"-";"-";"Ce jeu a un perdant";"~";"~";"~";"~"
"465";"périmètre";"+";"-";"+";"+";"+";"-";"-";"Cette école comporter un périmètre (pour jouer)";"~";"~";"~";"~"
"466";"péripétie";"+";"-";"-";"-";"+";"-";"-";"Cette histoire a plusieurs péripéties";"~";"~";"~";"~"
"467";"périphérie";"+";"-";"-";"+";"-";"-";"-";"La ville a une périphérie";"~";"~";"~";"~"
"468";"personnage";"+";"-";"-";"-";"+";"-";"-";"Cette pièce (E+de théâtre) a un personnage central";"~";"~";"~";"~"
"469";"perspective";"+";"-";"-";"-";"+";"-";"-";"Ce jardin a une perspective";"~";"~";"~";"~"
"470";"perspective";"+";"-";"-";"-";"+";"-";"+";"(Ce travail+Le travail de Max) a une perspective";"~";"~";"Max a une perspective dans son travail";"~"
"471";"phase";"+";"-";"+";"-";"+";"-";"-";"Cette opération a (une phrase+plusieurs phases)";"~";"~";"~";"~"
"472";"phraséologie";"+";"-";"-";"-";"+";"-";"-";"Ce lexique comporte une phraséologie";"~";"~";"~";"~"
"473";"pied";"+";"-";"-";"-";"+";"-";"-";"Ce vers a des pieds";"~";"~";"~";"~"
"474";"pivot";"+";"-";"-";"+";"-";"-";"-";"Cette politique a un pivot";"~";"~";"~";"~"
"475";"place";"+";"-";"-";"-";"+";"-";"-";"Cette voiture a quatre places";"~";"~";"~";"~"
"476";"plan";"+";"-";"-";"-";"+";"-";"-";"Ce bâtiment a un plan";"~";"~";"~";"~"
"477";"pli";"+";"-";"-";"+";"-";"-";"+";"Ce tissu a un pli";"~";"~";"~";"~"
"478";"pliure";"+";"-";"-";"-";"+";"-";"-";"Ce (tissu+papier) a une pliure";"~";"~";"~";"~"
"479";"pluriel";"+";"-";"-";"+";"+";"-";"-";"Cette langue a un pluriel";"~";"~";"~";"~"
"480";"plus";"+";"-";"-";"-";"+";"-";"-";"Ce travail comporte un plus";"~";"~";"~";"~"
"481";"point";"+";"-";"-";"-";"+";"-";"-";"Ce discours comporte un point important";"~";"~";"~";"~"
"482";"point";"+";"-";"-";"+";"-";"-";"+";"Ce vêtement a un point";"~";"~";"~";"~"
"483";"points";"+";"-";"-";"-";"+";"-";"-";"Ce papier a des points";"~";"~";"~";"~"
"484";"pôle";"+";"-";"-";"-";"+";"-";"-";"~";"~";"~";"~";"~"
"485";"ponctuation";"+";"-";"-";"-";"+";"-";"-";"Cette (phrase+texte) a une ponctuation";"~";"~";"~";"~"
"486";"population";"+";"-";"+";"-";"+";"-";"-";"Cette rôle a une population (E+de 1000 habitants)";"~";"~";"~";"~"
"487";"préalable";"+";"-";"-";"+";"-";"-";"-";"Cette négociation comporte un préalable";"~";"~";"~";"~"
"488";"préambule";"+";"-";"+";"+";"+";"+";"-";"~";"~";"~";"~";"~"
"489";"précédent";"+";"-";"-";"+";"-";"-";"-";"Ce jugement a un précédent";"~";"~";"~";"~"
"490";"préfixe";"+";"-";"-";"+";"+";"-";"-";"Ce mot a un préfixe";"~";"~";"~";"~"
"491";"préliminaire";"+";"-";"-";"+";"-";"-";"-";"~";"~";"~";"~";"~"
"492";"prémisses";"+";"-";"-";"-";"+";"-";"-";"Ce syllogisme a deux prémisses";"~";"~";"~";"~"
"493";"préposition";"+";"-";"-";"-";"+";"-";"-";"Cette (langue+complément) a des prépositions";"~";"~";"~";"~"
"494";"présupposé";"+";"-";"-";"-";"+";"-";"-";"Cette affirmation comporte un présupposé";"~";"~";"~";"~"
"495";"prétérit";"+";"-";"-";"-";"+";"-";"-";"Cette (conjugaison+langue) a un prétérit";"~";"~";"~";"~"
"496";"procédure";"+";"-";"-";"-";"+";"-";"-";"Le divorce comporte une procédure";"~";"~";"~";"~"
"497";"prolongement";"+";"-";"+";"+";"-";"-";"-";"L'autoroute a un prolongement";"~";"~";"~";"~"
"498";"prolongements";"+";"-";"-";"+";"+";"-";"-";"Cette affaire a des prolongements";"~";"~";"~";"~"
"499";"protagoniste";"+";"-";"-";"-";"+";"-";"-";"Cette affaire a deux protagonistes";"~";"~";"~";"~"
"500";"protocole";"+";"-";"-";"-";"+";"-";"-";"Cette cérémonie a un protocole";"~";"~";"~";"~"
"501";"quartier";"+";"-";"-";"-";"+";"-";"-";"La ville a des quartiers";"~";"~";"~";"~"
