"<ID>";"<ENT>N";"N0 =: Nhum";"N0 =: Ncoll";"Det =: un-de Dnum Nmes";"il y avoir Det N à N0";"il y avoir Det N Loc N0";"Vsup =: mettre";"Vsup =: faire";"Exemple Base1";"Exemple Autre1";"Exemple Autre2";"Exemple Autre3";"Exemple Autre4"
"1";"à côté";"+";"-";"-";"-";"+";"-";"-";"Cette situation a des à-côté désagréables";"~";"~";"~";"~"
"2";"à coup";"+";"-";"-";"-";"+";"-";"-";"Le moteur a des à-coup";"Il y a des à-coup dans le moteur";"~";"~";"~"
"3";"ablatif";"+";"-";"-";"-";"+";"-";"-";"Cette déclinaison a un ablatif";"Il y a un ablatif dans cette déclinaison";"~";"~";"~"
"4";"abrupt";"+";"-";"+";"-";"+";"-";"+";"~";"~";"~";"~";"~"
"5";"absurde";"+";"-";"-";"-";"+";"-";"-";"Cette situation comporte un absurde total";"Il y a un absurde total dans cette situation";"~";"~";"GN =: [l'absurde de cette situation]"
"6";"accéléré";"+";"-";"-";"-";"+";"-";"-";"Ce film a un accéléré";"Il y a un accéléré dans ce film";"~";"~";"~"
"7";"accent";"+";"-";"-";"-";"+";"+";"-";"La syllabe (a+prend+porte+perd) l'accent";"~";"~";"~";"~"
"8";"accès";"+";"-";"-";"-";"+";"+";"-";"Cette maison a deux accès";"~";"~";"~";"~"
"9";"accessoire";"+";"-";"-";"-";"+";"-";"-";"Une voiture a des accessoires";"~";"~";"~";"~"
"10";"accusatif";"+";"-";"-";"-";"+";"-";"-";"Ce mot a un accusatif";"~";"~";"~";"~"
"11";"acmé";"+";"-";"-";"-";"+";"-";"-";"Cette maladie a un acmé";"~";"~";"~";"~"
"12";"acoustique";"+";"-";"-";"-";"+";"-";"-";"Cette salle a une bonne acoustique";"~";"~";"~";"~"
"13";"actant";"+";"-";"-";"-";"+";"-";"-";"Cette phrase a deux actants";"~";"~";"~";"~"
"14";"acteur";"+";"-";"-";"-";"+";"-";"-";"La révolution a eu plusieurs acteurs";"~";"~";"~";"GN =: [un des acteur de la révolution]"
"15";"actif";"+";"-";"+";"-";"+";"-";"-";"~";"~";"Cette entreprise a un actif d'un million de Franc";"~";"~"
"16";"actif";"+";"-";"-";"-";"+";"-";"-";"(Ce verbe+Cette conjugaison) a un actif";"~";"~";"~";"~"
"17";"action";"+";"-";"-";"-";"+";"-";"-";"Ce roman a une action";"~";"~";"~";"~"
"18";"addenda";"+";"-";"-";"+";"-";"+";"-";"Cette annonce a un addenda";"Il y a un addenda à cet ouvrage";"~";"~";"~"
"19";"additif";"+";"-";"-";"+";"-";"+";"-";"Ce budget a un additif";"Il y a des additifs dans ces conserves";"~";"~";"~"
"20";"administration";"+";"+";"-";"-";"+";"-";"-";"Ce pays a une administration";"~";"~";"~";"~"
"21";"adret";"+";"-";"-";"-";"-";"-";"-";"La montagne a un adret";"~";"~";"~";"~"
"22";"affixe";"+";"-";"-";"-";"+";"-";"-";"Ce mot a un affixe";"~";"~";"~";"~"
"23";"affluent";"+";"-";"-";"+";"-";"-";"-";"La seine a des affluents";"~";"~";"~";"La Marne est un affluent de la Seine"
"24";"aigu";"+";"-";"-";"-";"+";"-";"-";"Cet instrument a des aigus (E+agréable)";"~";"~";"~";"~"
"25";"aimantation";"+";"-";"-";"-";"+";"-";"-";"Ce couteau a une légère aimantation";"~";"~";"~";"~"
"26";"ajour";"+";"-";"-";"-";"+";"+";"-";"Cette sculpture a un ajour";"~";"~";"~";"~"
"27";"aléa";"+";"-";"-";"-";"+";"-";"-";"Ce métier a des aléas";"Il y a des aléas dans ce métier";"~";"~";"~"
"28";"alentours";"+";"-";"-";"-";"-";"-";"-";"L'école a des alentours agréables";"~";"~";"~";"~"
"29";"alinéa";"+";"-";"-";"-";"+";"+";"-";"Ce texte a un alinéa";"~";"~";"~";"~"
"30";"altération";"+";"-";"-";"-";"+";"+";"-";"Cette mesure a une altération";"~";"~";"~";"~"
"31";"alternative";"+";"-";"-";"+";"-";"-";"-";"Cette situation comporte une alternative";"~";"~";"~";"~"
"32";"âme";"+";"-";"-";"-";"+";"+";"-";"Ce pays a une âme";"Il y a 1000 âmes dans ce village";"Ce village a 1000 âmes";"~";"~"
"33";"amont";"+";"-";"-";"-";"-";"-";"-";"Le fleuve a un amont";"~";"~";"~";"~"
"34";"anfractuosité";"+";"-";"-";"-";"+";"-";"+";"Cette paroi a des anfractuosités";"Il y a des anfractuosités dans cette paroi";"~";"~";"~"
"35";"angle";"+";"-";"-";"-";"+";"-";"-";"Cette pierre a deux angles gênants";"Il y a deux angles gênants à cette pierre";"~";"~";"~"
"36";"annexe";"+";"-";"-";"+";"-";"+";"-";"Ce (bâtiment+livre) a une annexe";"~";"~";"~";"~"
"37";"anomalie";"+";"-";"-";"-";"+";"-";"-";"(Cette pièce+Ce texte) a des anomalies";"Il y a des anomalies dans ce raisonnement";"~";"~";"~"
"38";"antécédent";"+";"-";"-";"+";"-";"-";"-";"Ce pronom a un antécédent";"Il y a des antécédents à la classification des noms";"~";"~";"~"
"39";"antidote";"+";"-";"-";"+";"-";"-";"-";"La mélancolie a un antidote";"~";"~";"~";"Ce film est un antidote à la mélancolie"
"40";"aoriste";"+";"-";"-";"-";"+";"-";"-";"Cette entreprise comporte un aoriste";"~";"~";"~";"~"
"41";"aplat";"+";"-";"-";"-";"+";"-";"+";"Ce tableau comporte (un aplat+des aplats)";"~";"~";"~";"~"
"42";"apostille";"+";"-";"-";"-";"+";"-";"+";"La lettre a une apostille";"~";"~";"~";"~"
"43";"appareil";"-";"+";"-";"-";"+";"-";"-";"Ce parti a un appareil";"~";"~";"~";"~"
"44";"appendice";"+";"-";"-";"+";"-";"-";"+";"Ce livre a un appendice";"~";"~";"~";"Ce texte est un appendice (à+de) le livre de Harris"
"45";"arborescence";"+";"-";"-";"-";"-";"-";"+";"Le dessin (a+comporte) des arborescences";"~";"~";"~";"~"
"46";"ascendance";"+";"-";"-";"-";"+";"-";"-";"~";"Il y a, ce matin, des ascendances d'air favorables";"~";"~";"~"
"47";"aspects";"+";"-";"-";"-";"+";"-";"-";"Cette question (a+comporte) plusieurs aspects";"~";"~";"~";"~"
"48";"aspérité";"+";"-";"-";"-";"+";"-";"-";"(Le sol+Cette surface) a  des aspérités";"Il y a des aspérités sur cette surface";"~";"~";"~"
"49";"attribut";"+";"-";"-";"+";"-";"-";"-";"Ce noru a un attribut";"~";"~";"~";"~"
"50";"augment";"+";"-";"-";"-";"+";"-";"-";"Cette fonction a un argument";"~";"~";"~";"~"
"51";"auréole";"+";"-";"-";"-";"+";"-";"+";"(La robe a des auréoles+Ce produit a (une auréole blanche autour de la fâche+des auréoles sur la robe))";"~";"~";"~";"~"
"52";"auxiliaire";"+";"-";"-";"+";"-";"-";"-";"Cette conjugaison a un auxiliaire";"~";"~";"~";"~"
"53";"aval";"+";"-";"-";"-";"-";"-";"-";"~";"~";"~";"~";"~"
"54";"avance";"+";"-";"+";"-";"+";"-";"-";"~";"~";"~";"~";"~"
"55";"avant";"+";"-";"-";"+";"-";"-";"-";"La voiture a un avant";"~";"~";"~";"~"
"56";"avantage";"+";"-";"-";"+";"-";"-";"-";"Cette situation (a+comporte) un avantage";"Il y a un avantage dans cette situation";"~";"~";"~"
"57";"avarie";"+";"-";"-";"+";"+";"-";"+";"Le bateau (a+subit) des avaries";"~";"La tempête (inflige+cause) des avaries au bateau";"~";"~"
"58";"avers";"+";"-";"-";"+";"-";"-";"-";"Cette (médaille+monnaie) a un avers";"~";"~";"~";"~"
"59";"axe";"+";"-";"-";"+";"+";"-";"-";"(Cette politique+Ce cylindre) a un axe";"~";"~";"~";"~"
"60";"background";"+";"-";"-";"-";"+";"-";"-";"Cette ville a un background";"~";"~";"~";"~"
"61";"barre";"+";"-";"-";"-";"+";"+";"-";"L'échelle des mots (a+comporte) une barre";"~";"~";"~";"~"
"62";"bas";"+";"-";"-";"+";"-";"-";"-";"La montagne a un bas";"~";"~";"~";"GN =: [Le bas de la montagne]"
"63";"base";"+";"-";"+";"+";"-";"-";"-";"Cette théorie a une base";"~";"~";"~";"~"
"64";"bas-fonds";"-";"+";"-";"-";"+";"-";"-";"Cette société a des bas-fonds";"Il y a des bas-fonds dans toute société";"~";"~";"~"
"65";"béance";"+";"-";"-";"-";"+";"-";"-";"~";"Il y a une béance dans ma vie";"~";"~";"~"
"66";"bécarre";"+";"-";"-";"-";"+";"+";"-";"Cette note a un bécarre";"~";"~";"~";"~"
"67";"bémol";"+";"-";"-";"-";"+";"+";"-";"Cette note a un bémol";"Il y a un bémol (sur cette  note+à ses affirmations)";"~";"~";"~"
"68";"biais";"+";"-";"-";"+";"+";"-";"-";"Le tissu a un biais";"~";"~";"~";"~"
"69";"bioclimat";"+";"-";"-";"-";"+";"-";"-";"Cette région a un bioclimat";"~";"~";"~";"~"
"70";"bissectrice";"+";"-";"-";"-";"+";"-";"-";"Cet angle a une bissectrice";"~";"~";"~";"~"
"71";"bitension";"+";"-";"-";"-";"+";"-";"-";"Ce fil électrique a une bitension";"~";"~";"~";"~"
"72";"blanc";"+";"-";"-";"-";"+";"+";"-";"~";"Il y a un blanc (sur cette page+entre des mots)";"~";"~";"~"
"73";"bord";"+";"-";"-";"+";"-";"-";"-";"Cette surface a un bord";"~";"~";"~";"~"
"74";"bordure";"+";"-";"+";"+";"-";"+";"-";"Cette chaussée a une bordure";"~";"~";"~";"~"
"75";"borne";"+";"-";"-";"+";"-";"+";"-";"(Max (a+a mis) des bornes à ce champ+Ce champ a des bornes)";"~";"~";"~";"~"
"76";"bornes";"+";"-";"-";"+";"-";"+";"-";"Le cynisme a des bornes";"Il y a des bornes au cynisme";"~";"~";"~"
"77";"bosse";"+";"-";"+";"-";"+";"-";"-";"Cette plaque a des bosses";"Il y a des bosses sur cette plaque";"~";"~";"~"
"78";"bout";"+";"-";"-";"+";"-";"-";"-";"Le bâton a deux bouts";"~";"~";"~";"~"
"79";"brèche";"+";"-";"+";"-";"+";"-";"+";"~";"~";"~";"~";"~"
"80";"bureau";"-";"+";"-";"-";"+";"-";"-";"L'association a un bureau";"~";"~";"~";"~"
"81";"cadre";"+";"-";"-";"+";"-";"-";"-";"Cette scène a un cadre";"~";"~";"~";"~"
"82";"canevas";"+";"-";"-";"-";"+";"-";"-";"Le roman a un certain canevas";"Il y a un certain canevas à ce roman";"~";"~";"~"
"83";"canon";"+";"-";"-";"+";"-";"-";"-";"La (messe+cérémonie) a un canon";"~";"~";"~";"~"
"84";"caractéristique";"+";"+";"-";"-";"+";"-";"-";"Ce moteur a des caractéristiques";"~";"~";"~";"~"
"85";"carence";"+";"-";"-";"-";"+";"-";"-";"Ce travail (a+comporte) des carences";"Il y a des carences dans ce travail";"~";"~";"~"
"86";"cas";"+";"-";"-";"-";"+";"-";"-";"Cette langue a des cas";"~";"~";"~";"~"
"87";"cassis";"-";"-";"-";"-";"+";"-";"-";"La route a des cassis";"Il y a des cassis sur la route";"~";"~";"~"
"88";"caste";"-";"+";"-";"-";"+";"-";"-";"Cette société a des castes";"Il y a des castes dans cette société";"~";"~";"Max est de la caste des intouchables"
"89";"catégorie";"+";"-";"-";"-";"+";"-";"-";"(Ces verbes (ont+forment) une catégorie+Les verbes comportent 26 catégories)";"Il y a 26 catégories dans les verbes";"~";"~";"Cette langue a 7 catégories (E+de mots)"
"90";"cause";"+";"-";"-";"+";"-";"-";"-";"Ce phénomène a une cause";"~";"~";"~";"~"
"91";"cavité";"+";"-";"-";"-";"+";"-";"+";"La roche a une cavité";"Il y a une cavité dans la roche";"~";"~";"~"
"92";"cédille";"+";"-";"-";"+";"+";"+";"-";"Cette consonne a une cédille";"Il y a une cédille à cette consonne";"~";"~";"~"
"93";"centaine";"+";"-";"-";"-";"+";"-";"-";"Ce nombre a 5 centaines";"~";"~";"~";"~"
"94";"centre";"+";"-";"-";"-";"+";"-";"-";"(Le cercle+Cette figure) a un centre";"~";"~";"~";"~"
"95";"cérémonial";"+";"-";"-";"-";"+";"-";"-";"(La passation des fourmis+Le cours de Z+le repas) (a+comporte) un cérémonial";"~";"~";"~";"~"
"96";"cerveau";"+";"-";"-";"-";"+";"-";"-";"Cette opération de commande a un cerveau";"~";"~";"~";"~"
"97";"césure";"+";"-";"-";"-";"+";"+";"-";"Le vers a une césure à son hémistiche";"Il y a une césure à l'hémistiche du sens";"~";"~";"~"
"98";"chapitre";"+";"-";"-";"-";"+";"-";"+";"Ce livre a trois chapitres";"~";"~";"~";"GN =: [un chapitre de chanson]"
"99";"charges";"+";"-";"+";"-";"+";"-";"-";"Cet appartement a des charges";"~";"~";"~";"~"
"100";"chef-lieu";"+";"-";"-";"-";"+";"+";"-";"~";"~";"~";"~";"~"
"101";"cheville";"+";"-";"-";"-";"+";"+";"-";"~";"~";"~";"~";"~"
"102";"cime";"+";"-";"-";"-";"-";"-";"-";"Cette montagne a une cime";"~";"~";"~";"~"
"103";"classe";"+";"+";"-";"-";"+";"-";"-";"La société a des classes";"Il y a plusieurs classes dans les chemins de jeu français";"~";"~";"GN =: [des classes (d'enterrement+de compétition)]"
"104";"clause";"+";"-";"-";"-";"+";"-";"-";"Ce contrat a plusieurs clauses";"Il y a plusieurs clauses à ce contrat";"~";"~";"~"
"105";"clausule";"+";"-";"-";"-";"+";"-";"-";"Cette strophe a une clausule";"~";"~";"~";"~"
"106";"clé";"+";"-";"-";"+";"+";"-";"-";"Ce roman a une clé";"~";"~";"~";"~"
"107";"cloque";"+";"-";"-";"-";"+";"-";"-";"Luc a (une cloque+des cloques) sur la main";"Il y a des cloques sur la main de Luc";"~";"~";"~"
"108";"code";"+";"-";"-";"-";"+";"+";"-";"La politesse a un code qui varie de pays à pays";"~";"~";"~";"~"
"109";"codicille";"+";"-";"-";"+";"-";"+";"-";"le testament a un codicille";"Il y a un codicille au testament";"~";"~";"~"
"110";"coin";"+";"-";"-";"-";"+";"-";"-";"La cour a quatre coins";"~";"~";"~";"~"
"111";"combinaison";"+";"-";"-";"+";"-";"+";"-";"Ce coffre-fort a une combinaison compliquée";"Il y a une combinaison à  ce coffre-fort";"~";"~";"~"
"112";"comparatif";"+";"-";"-";"-";"+";"-";"-";"Cette langue a un comparatif";"~";"~";"~";"~"
"113";"compartiment";"+";"-";"-";"-";"+";"-";"-";"Cette boîte a plusieurs compartiments";"~";"~";"~";"~"
"114";"compensations";"+";"-";"-";"-";"+";"-";"-";"Cette corvée (a+comporte) des compensations";"~";"~";"~";"~"
"115";"complément";"+";"-";"-";"-";"+";"-";"-";"Ce livre (a+comporte) un complément";"~";"~";"~";"~"
"116";"complément";"+";"-";"-";"+";"-";"-";"-";"Ce verbe (a+prend) un complément";"~";"~";"~";"~"
"117";"complétive";"+";"-";"-";"-";"+";"-";"-";"Cette construction a une complétive";"~";"~";"~";"~"
"118";"composant";"+";"-";"-";"-";"+";"-";"-";"~";"Il y a deux composants dans ce corps";"~";"~";"~"
"119";"composante";"+";"-";"-";"-";"+";"-";"-";"~";"Il y a deux composantes à ce comportement";"~";"~";"~"
"120";"condition";"+";"-";"-";"+";"+";"+";"-";"Cet accord (a+comporte) une condition";"Il y a une condition à ce que tout sont remis en ordre";"~";"~";"~"
"121";"conditionnel";"+";"-";"-";"-";"+";"-";"-";"Cette conjugaison a un conditionnel";"~";"~";"~";"~"
"122";"confins";"+";"-";"-";"-";"-";"-";"-";"Cette ville a des confins (*E+déserts)";"~";"~";"~";"~"
"123";"conjugaison";"+";"-";"-";"-";"+";"-";"-";"(Cette langue a une conjugaison+Ce verbe a une conjugaison défective)";"~";"~";"~";"~"
"124";"conséquence";"+";"-";"-";"+";"-";"-";"-";"Cet événement a des conséquences fâcheuses";"Il y a des conséquences malheureuses à cet événement";"~";"~";"~"
"125";"constante";"+";"-";"-";"-";"+";"-";"-";"La conduite de Max (a+présente) une constante";"~";"~";"~";"~"
"126";"constituant";"+";"-";"-";"-";"+";"-";"-";"~";"Il y a 100 constituants dans cet ensemble";"Cet ensemble a 100 constituants";"~";"~"
"127";"construction";"+";"-";"-";"-";"+";"-";"-";"Ce quartier a des constructions modernes";"~";"~";"~";"~"
"128";"contenu";"+";"-";"-";"-";"+";"-";"-";"Cette lettre a un contenu important";"~";"~";"~";"~"
"129";"contraire";"+";"-";"-";"+";"-";"-";"-";"~";"~";"~";"~";"~"
"130";"contreforts";"+";"-";"-";"+";"-";"-";"-";"Cette (terrasse+chaussure) a des contreforts";"Il y a des contreforts à cette (terrasse+chaussure)";"~";"~";"~"
"131";"contrepartie";"+";"-";"-";"+";"-";"-";"-";"Ce dommage a une contrepartie";"~";"~";"~";"~"
"132";"contrepoids";"+";"-";"-";"+";"-";"-";"-";"~";"~";"~";"~";"~"
"133";"contrepoison";"+";"-";"-";"+";"-";"-";"-";"L'amanite a un contrepoison";"~";"~";"~";"~"
"134";"corps";"+";"-";"-";"+";"-";"-";"-";"~";"~";"~";"~";"~"
"135";"corps";"-";"+";"+";"-";"+";"-";"-";"~";"~";"~";"~";"~"
"136";"corollaire";"+";"-";"-";"+";"-";"-";"-";"Cette théorie a un corollaire";"Il y a trois corollaires  à cette théorie";"~";"~";"~"
"137";"côté";"+";"-";"+";"+";"-";"-";"-";"~";"~";"Cette figure a deux côtés";"~";"~"
"138";"côté";"+";"-";"-";"-";"+";"-";"-";"Ce procès a un côté (*E+intéressant)";"~";"~";"~";"~"
"139";"côte";"+";"-";"+";"-";"+";"-";"-";"La route (a+comporte) une côte";"~";"~";"~";"~"
"140";"couche";"+";"+";"-";"-";"+";"-";"-";"(Le sol+La société) (a+comporte) plusieurs couches";"~";"~";"~";"~"
"141";"coulisses";"+";"-";"-";"-";"+";"-";"-";"La vie politique a des coulisses";"~";"~";"~";"~"
"142";"courant";"+";"-";"-";"-";"+";"-";"-";"La rivière a un courant violent";"Il y a (un courant violent+du courant) dans cette rivière";"~";"La rivière a du courant";"~"
"143";"courant";"-";"+";"-";"-";"+";"-";"-";"Ce parti a (un courant+des courants)";"~";"~";"~";"~"
"144";"courant";"+";"-";"+";"-";"+";"-";"-";"Ce lac a des courants";"Il y a des courants dans ce lac";"~";"~";"~"
"145";"courbe";"+";"-";"-";"+";"+";"-";"-";"La route (a+fait) une courbe";"~";"~";"~";"~"
"146";"cran";"+";"-";"-";"+";"-";"-";"+";"Max a mis des crans sur la pièce";"~";"~";"~";"~"
"147";"cratère";"+";"-";"+";"-";"+";"-";"+";"La bombe a fait un cratère dans le sol";"Il y a (un cratère dans le sol+ ces cratères sur le sol de la lune)";"~";"~";"~"
"148";"créneau";"+";"-";"-";"+";"-";"-";"-";"La tour a des créneaux";"Il y a des créneaux sur la tour";"~";"~";"~"
"149";"crénelure";"+";"-";"-";"+";"+";"+";"-";"Cette feuille a une crénelure admirable";"~";"~";"~";"~"
"150";"crescendo";"+";"-";"-";"-";"+";"-";"-";"Ce passage a un crescendo";"Il y a un crescendo dans ce passage";"~";"~";"~"
"151";"crête";"+";"-";"-";"-";"+";"-";"-";"La (montagne+vague) a une crête";"~";"~";"~";"~"
"152";"creux";"+";"-";"+";"-";"+";"-";"+";"(Le terrain+L'emploi du temps) a un creux";"Il y a un creux dans (la vente de cet article+le mur)";"~";"~";"~"
"153";"crevasse";"+";"-";"+";"-";"+";"-";"+";"Le sol a des crevasses";"Il y a des crevasses dans le sol";"~";"~";"~"
"154";"cultures";"+";"-";"-";"-";"+";"-";"+";"Ce pays a des cultures";"~";"~";"~";"~"
"155";"cursus";"+";"-";"+";"-";"+";"-";"-";"Cette filière a un cursus";"~";"~";"~";"~"
"156";"cycle";"+";"-";"+";"-";"+";"-";"-";"(L'année+La succession des maisons) a un cycle";"~";"~";"~";"~"
"157";"datif";"+";"-";"-";"-";"+";"-";"-";"Cette (langue+déclinaison) a un datif";"~";"~";"~";"~"
"158";"débouché";"+";"-";"-";"-";"+";"-";"-";"Ces études ont un débouché";"Il y a des débouchés aux études supérieurs";"~";"~";"~"
"159";"début";"+";"-";"-";"+";"-";"-";"-";"(Ce livre+Cette aventure) a un début bizarre";"~";"~";"~";"~"
"160";"décimale";"+";"-";"-";"-";"+";"-";"-";"Ce nombre a cinq décimales";"Il y a cinq décimales à ce nombre";"~";"~";"~"
"161";"déclinaison";"+";"-";"-";"-";"+";"-";"-";"(Cette langue a des déclinaisons+Ce mot a une déclinaison irrégulière)";"~";"~";"~";"~"
"162";"déclive";"+";"-";"+";"-";"+";"-";"-";"La route a une certaine déclive";"~";"~";"~";"~"
"163";"décolleté";"+";"-";"-";"+";"-";"-";"+";"Cette robe a un décolleté";"~";"~";"~";"~"
"164";"décor";"+";"-";"-";"-";"+";"-";"-";"Ce roman a un décor urbain";"~";"~";"~";"~"
"165";"décorum";"+";"-";"-";"-";"+";"-";"-";"Cette cérémonie a un certain décorum";"Il y a un certain décorum dans cette cérémonie";"~";"~";"~"
"166";"décote";"+";"-";"+";"-";"+";"-";"-";"Cet impôt (a+comporte) une décote";"~";"~";"~";"~"
"167";"decrescendo";"+";"-";"-";"-";"+";"-";"-";"Cette mesure a un decrescendo";"Il y a un descrescendo dans cette mesure";"~";"~";"~"
"168";"décrochement";"+";"-";"+";"-";"+";"-";"-";"Le mur (a+fait) un décrochement";"Il y a un décrochement entre ces deux terrains";"~";"~";"~"
"169";"dedans";"+";"-";"-";"+";"-";"-";"-";"Cet objet a un dedans";"~";"~";"~";"~"
"170";"défaut";"+";"-";"-";"+";"+";"-";"-";"(Max+La veste) a un défaut";"Il y a un défaut (chez Max+à la veste)";"~";"~";"GN =: [un défaut de mentir]"
"171";"défense";"+";"-";"-";"-";"+";"+";"-";"~";"~";"~";"~";"~"
"172";"déformation";"+";"-";"-";"-";"+";"-";"-";"(Ce métal+Cette pièce en métal) a une déformation";"~";"~";"~";"~"
"173";"dehors";"+";"-";"-";"+";"-";"-";"-";"Cette boîte a un dehors";"~";"~";"~";"~"
"174";"démographie";"+";"-";"-";"-";"+";"-";"-";"La France a une démographie en baisse";"~";"~";"~";"~"
"175";"dénivelé";"+";"-";"+";"-";"+";"-";"-";"~";"~";"~";"~";"~"
"176";"dénominateur";"+";"-";"-";"-";"+";"-";"-";"Cette fraction a un dénominateur";"~";"~";"~";"~"
"177";"dénouement";"+";"-";"-";"+";"+";"-";"+";"Cette affaire a un dénouement inattendu";"~";"~";"~";"~"
"178";"dents";"+";"-";"-";"+";"-";"-";"-";"Cette roue a des dents ";"~";"~";"~";"~"
"179";"dépression";"+";"-";"-";"-";"+";"-";"-";"Ce terrain (a+présente) une dépression";"Il y a une dépression dans ce terrain";"~";"~";"~"
"180";"dérivation";"+";"-";"-";"+";"-";"+";"-";"Ce fleuve a une dérivation";"~";"La fusée a une dérivation de deux degrés";"~";"~"
"181";"descente";"+";"-";"+";"-";"+";"-";"-";"La route a (une descente+des descentes) à cet endroit là";"~";"~";"~";"~"
"182";"désinence";"+";"-";"-";"-";"+";"-";"-";"Ce verbe a des désinences régulières";"Il y a des désinences régulières (à ce verbe+dans cette conjugaison)";"~";"~";"~"
"183";"désordres";"+";"-";"-";"-";"+";"-";"+";"~";"Il y a des désordres dans la rue";"~";"~";"~"
"184";"dessous";"+";"-";"-";"+";"-";"-";"-";"Cette assiette a un dessous peint";"~";"~";"~";"~"
"185";"dessous";"+";"-";"-";"-";"+";"-";"-";"Cette affaire a des dessous louches";"~";"~";"~";"~"
"186";"dessus";"+";"-";"-";"+";"-";"-";"-";"Cette assiette a un dessus décoré";"~";"~";"~";"~"
"187";"détail";"+";"-";"-";"-";"+";"-";"-";"ce tableau a un détail bizarre";"~";"~";"~";"~"
"188";"déterminant";"+";"-";"-";"-";"+";"-";"-";"Le nom a un déterminant";"~";"~";"~";"~"
"189";"devant";"+";"-";"-";"+";"-";"-";"-";"Cette robe a un devant ouvragé";"Il y a un devant à cette robe";"~";"~";"~"
"190";"dévers";"+";"-";"-";"+";"+";"-";"-";"~";"~";"La route a un dévers de 30 degrés";"~";"~"
"191";"diagonale";"+";"-";"-";"-";"+";"-";"-";"Ce quadrilatère a deux diagonales";"~";"~";"~";"~"
"192";"diaprure";"+";"-";"-";"-";"+";"+";"-";"Cette étoffe a (*une diaprure+des diaprures)";"~";"~";"~";"~"
"193";"dièse";"+";"-";"-";"-";"+";"+";"-";"Cette note a un dièse";"~";"~";"~";"~"
"194";"dimension";"+";"-";"-";"+";"+";"-";"-";"Cette affaire (a+prend) (une dimension démesurée+des dimensions démesurées)";"~";"~";"~";"~"
"195";"disharmonie";"+";"-";"-";"-";"+";"-";"-";"~";"~";"~";"~";"~"
"196";"dispositif";"+";"-";"-";"-";"+";"+";"-";"Ce prêt a un dispositif complexe";"~";"~";"~";"~"
"197";"dissonance";"+";"-";"-";"-";"+";"-";"-";"Ce passage (a+comporte) une dissonance";"~";"~";"~";"~"
"198";"distorsion";"+";"-";"+";"-";"+";"-";"+";"Les sons ont une distorsion";"~";"~";"~";"~"
"199";"diviseur";"+";"-";"-";"-";"+";"-";"-";"Ce nombre a un diviseur";"~";"~";"~";"~"
"200";"division";"+";"-";"+";"-";"+";"-";"-";"L'armée a plusieurs divisions";"Il y a plusieurs divisions dans l'armée";"~";"~";"~"
"201";"division";"+";"-";"-";"-";"+";"+";"-";"(Cette classe+La boîte+Le texte) a plusieurs divisions";"Il y a plusieurs divisions dans (cette classe+la boîte+le texte)";"~";"~";"~"
"202";"dizaine";"+";"-";"-";"-";"+";"-";"-";"Ce nombre a (une dizaine+plusieurs dizaines)";"~";"~";"~";"~"
"203";"doctrine";"+";"+";"-";"-";"+";"-";"-";"~";"~";"~";"~";"~"
"204";"dogme";"+";"-";"-";"-";"+";"-";"-";"Cette religion (a+comporte) un dogme";"~";"~";"~";"~"
"205";"domaine";"+";"-";"-";"-";"+";"-";"-";"Cette discipline a plusieurs domaines";"Il y a plusieurs domaines dans cette discipline";"~";"~";"~"
"206";"dominante";"+";"-";"-";"-";"+";"-";"-";"Cet accord a une dominante";"Il y a une dominante dans cet accord";"~";"~";"~"
"207";"donnée";"+";"-";"-";"-";"+";"-";"-";"(Ce problème+La situation) a des données précises";"~";"~";"~";"~"
"208";"dos";"+";"-";"-";"+";"-";"-";"-";"(Cet objet+Ce livre) a un dos";"~";"~";"~";"~"
"209";"drapé";"+";"-";"-";"+";"-";"-";"+";"La robe a un drapé élégant";"~";"~";"~";"~"
"210";"droite";"+";"-";"-";"-";"+";"-";"-";"Cet objet a une droite et une gauche";"~";"~";"~";"~"
"211";"droite";"-";"+";"-";"-";"+";"-";"-";"Ce parti a une droite";"~";"~";"~";"~"
"212";"duel";"+";"-";"-";"-";"+";"-";"-";"Cette déclinaison a un duel";"~";"~";"~";"Le duel est un nombre grammatical"
"213";"dynamique";"+";"-";"-";"-";"+";"-";"-";"Ce mouvement a une  dynamique";"~";"~";"~";"~"
"214";"dysfonction";"+";"-";"-";"-";"+";"-";"-";"~";"~";"~";"~";"~"
"215";"dysfonctionnement";"+";"-";"-";"-";"+";"-";"-";"Cette glande a un certain dysfonctionnement";"~";"~";"~";"~"
"216";"ébréchure";"+";"-";"-";"+";"+";"-";"+";"~";"~";"~";"~";"~"
"217";"échappée";"+";"-";"-";"-";"+";"-";"-";"Le paysage a une échappée";"Il y a une échappée sur la mer entre les collines";"~";"~";"~"
"218";"échappement";"+";"-";"-";"+";"+";"-";"-";"Cet appareil a un échappement";"~";"~";"~";"~"
"219";"échéance";"+";"-";"+";"+";"+";"-";"-";"~";"~";"Cette dette a une  échéance de 2 mois";"~";"~"
"220";"échelon";"+";"-";"-";"-";"+";"-";"-";"Cette (carrière+organisation+armée) (a+comporte) des échelons";"~";"~";"~";"~"
"221";"éclairage";"+";"-";"-";"-";"+";"+";"-";"Cette pièce a un bon éclairage";"~";"~";"~";"~"
"222";"éclairement";"+";"-";"-";"-";"+";"-";"-";"Cette surface a un éclairement de tant de lux";"~";"~";"~";"~"
"223";"économie";"+";"-";"-";"-";"+";"-";"-";"Ce pays a une économie florissante";"~";"~";"~";"~"
"224";"écornure";"+";"-";"-";"+";"+";"-";"+";"La statue a une écornure";"~";"~";"~";"~"
"225";"écosystème";"+";"-";"-";"-";"+";"-";"-";"Cette région a un écosystème fragile";"~";"~";"~";"~"
"226";"écoulement";"+";"-";"-";"-";"+";"+";"-";"Le lavabo a un écoulement";"~";"~";"~";"~"
"227";"écriture";"+";"-";"-";"-";"+";"-";"-";"Ce peuple a une écriture";"~";"~";"~";"~"
"228";"écueil";"+";"-";"-";"+";"+";"-";"-";"Cette méthode présente des écueils";"~";"~";"~";"~"
"229";"effilochure";"+";"-";"-";"+";"-";"-";"+";"Ce tapis a des effilochures";"~";"~";"~";"~"
"230";"effondrement";"+";"-";"+";"-";"+";"-";"-";"Le sol a un effondrement ";"~";"~";"~";"~"
"231";"élargissement";"+";"-";"+";"-";"+";"-";"-";"La chaussée a un élargissement";"~";"~";"~";"~"
"232";"électricité";"+";"-";"-";"-";"+";"-";"-";"~";"~";"~";"Ce tissu a de l'électricité";"~"
"233";"élément";"+";"-";"-";"-";"+";"-";"-";"(Cet objet+Cette théorie) (a+comporte) plusieurs éléments";"Il y a plusieurs éléments dans cet objet";"~";"~";"~"
"234";"éliminatoires";"+";"-";"-";"-";"+";"+";"-";"Cet examen (a+comporte) des éliminatoires";"~";"~";"~";"~"
"235";"élision";"+";"-";"-";"-";"+";"-";"-";"Ce mot a une élision";"~";"~";"~";"~"
"236";"élite";"-";"+";"-";"-";"+";"-";"-";"Ce pays a une élite";"Il y a une élite dans ce pays";"~";"~";"~"
"237";"ellipse";"+";"-";"-";"-";"+";"-";"-";"Cette phrase comporte une ellipse";"~";"~";"~";"~"
"238";"embouchure";"+";"-";"+";"+";"-";"-";"-";"Ce fleuve a une embouchure";"~";"~";"~";"~"
"239";"embrasure";"+";"-";"-";"+";"-";"-";"-";"La fenêtre a une embrasure";"~";"~";"~";"~"
